{
  "schema": "assetsstudio_asset_registry_v1",
  "studio_version": "0.6.0",
  "updated": "2026-08-10",
  "preview": {
    "model_url": "/generated/actor-composite-v1.glb",
    "manifest_url": "/generated/actor-composite-v1.manifest.json",
    "storage_policy": "local"
  },
  "assets": [
    {
      "id": "body_actor_v1_walk",
      "category": "body",
      "label": "身体与动作",
      "status": "accepted",
      "source_path": "milestones/body/chibi_actor_mixamo_walk_v1.blend",
      "workflow": "docs/WORKFLOW_BODY.md",
      "known_issue": null,
      "visibility_group": null,
      "thumbnail_url": null,
      "thumbnail_kind": null
    },
    {
      "id": "hair_component_pool_v1",
      "category": "hair",
      "label": "发型组件池",
      "status": "source_contract",
      "source_path": "milestones/hair/hair_random_pool_v1.json",
      "workflow": "docs/WORKFLOW_HAIR.md",
      "known_issue": "female seed_04 v2 repaired the front-center scalp penetration and passed projection coverage; final user review is still required",
      "visibility_group": "hair",
      "thumbnail_url": "/generated/thumbnails/hair.png",
      "thumbnail_kind": "fixed_front"
    },
    {
      "id": "face_actor_v2_blink",
      "category": "face",
      "label": "五官与耳朵",
      "status": "technical_baseline",
      "source_path": "milestones/body/face_contract_v2.json",
      "workflow": "docs/WORKFLOW_FACE.md",
      "known_issue": null,
      "visibility_group": "face",
      "thumbnail_url": "/generated/thumbnails/face.png",
      "thumbnail_kind": "texture"
    },
    {
      "id": "top_actor_native_tshirt_v5",
      "category": "tops",
      "label": "短袖上衣",
      "status": "provisional",
      "source_path": "milestones/tops/actor_native_tshirt_v5/manifest.json",
      "workflow": "docs/WORKFLOW_TOPS.md",
      "known_issue": "pose-dependent right shoulder/sleeve protrusion",
      "visibility_group": "top",
      "thumbnail_url": "/generated/thumbnails/tops.png",
      "thumbnail_kind": "fixed_front"
    },
    {
      "id": "pants_native_control_v0",
      "category": "pants",
      "label": "短裤",
      "status": "provisional",
      "source_path": "milestones/pants/native_control_v0/manifest.json",
      "workflow": "docs/WORKFLOW_PANTS.md",
      "known_issue": "strict geometry report is not a production-quality visual verdict",
      "visibility_group": "pants",
      "thumbnail_url": "/generated/thumbnails/pants.png",
      "thumbnail_kind": "fixed_front"
    },
    {
      "id": "shoes_cartoon_sneaker_v10",
      "category": "shoes",
      "label": "卡通运动鞋",
      "status": "accepted",
      "source_path": "milestones/shoes/cartoon_sneaker_v10/manifest.json",
      "workflow": "docs/WORKFLOW_SHOES.md",
      "known_issue": null,
      "visibility_group": "shoes",
      "thumbnail_url": "/generated/thumbnails/shoes.png",
      "thumbnail_kind": "fixed_front"
    }
  ],
  "hair": {
    "first_bundle": {
      "id": "female_chloe_seed_04_bangs04_v2",
      "gender": "female",
      "status": "provisional",
      "components": [
        "Chloe_hair_bangs_04",
        "Chloe_hair_side_01",
        "Chloe_hair_back_01"
      ],
      "head_bone": "CC_Base_Head",
      "known_issue": "v1 center scalp penetration is repaired and passes projection coverage; final user review is still required"
    },
    "component_groups": [
      {
        "id": "female_front_bangs",
        "gender": "female",
        "role": "front_bangs",
        "status": "recommended",
        "objects": [
          "Chloe_hair_bangs_01",
          "Chloe_hair_bangs_02",
          "Chloe_hair_bangs_03",
          "Chloe_hair_bangs_04",
          "Chloe_hair_bangs_05"
        ]
      },
      {
        "id": "female_side",
        "gender": "female",
        "role": "side_coverage",
        "status": "recommended",
        "objects": [
          "Chloe_hair_side_01",
          "Chloe_hair_side_02",
          "Chloe_hair_side_03",
          "Chloe_hair_side_04",
          "Chloe_hair_side_05"
        ]
      },
      {
        "id": "female_base_cap",
        "gender": "female",
        "role": "base_cap",
        "status": "recommended",
        "objects": [
          "Chloe_hair_back_01"
        ]
      },
      {
        "id": "female_back_attachment",
        "gender": "female",
        "role": "back_attachment",
        "status": "experimental",
        "objects": [
          "Chloe_hair_back_02",
          "Chloe_hair_back_03"
        ]
      },
      {
        "id": "female_back_experimental",
        "gender": "female",
        "role": "experimental_back_shell",
        "status": "experimental",
        "objects": [
          "Chloe_hair_back_04",
          "Chloe_hair_back_05",
          "Chloe_hair_back_06",
          "Chloe_hair_back_07",
          "Chloe_hair_back_08",
          "Chloe_hair_back_09"
        ]
      },
      {
        "id": "male_front_bangs",
        "gender": "male",
        "role": "front_bangs",
        "status": "experimental",
        "objects": [
          "Colin_hair_bangs_01",
          "Colin_hair_bangs_02",
          "Colin_hair_bangs_03",
          "Colin_hair_bangs_04",
          "Colin_hair_bangs_05",
          "Colin_hair_bangs_06",
          "Colin_hair_bangs_07",
          "Colin_hair_bangs_08"
        ]
      },
      {
        "id": "male_side",
        "gender": "male",
        "role": "side_coverage",
        "status": "recommended",
        "objects": [
          "Colin_hair_side_01",
          "Colin_hair_side_02"
        ]
      },
      {
        "id": "male_back_section",
        "gender": "male",
        "role": "back_section",
        "status": "recommended",
        "objects": [
          "Colin_hair_back_01",
          "Colin_hair_back_02",
          "Colin_hair_back_03",
          "Colin_hair_back_04",
          "Colin_hair_back_05"
        ]
      },
      {
        "id": "male_back_experimental",
        "gender": "male",
        "role": "experimental_back_shell",
        "status": "recommended",
        "objects": [
          "Colin_hair_back_06"
        ]
      },
      {
        "id": "male_base_cap",
        "gender": "male",
        "role": "base_cap",
        "status": "experimental",
        "objects": [
          "Colin_hair_base_01",
          "Colin_hair_base_02"
        ]
      }
    ],
    "random_pool": [
      {
        "component_id": "female_base_cap:Chloe_hair_back_01",
        "group_id": "female_base_cap",
        "gender": "female",
        "role": "base_cap",
        "object": "Chloe_hair_back_01",
        "pool": true,
        "preset": false
      },
      {
        "component_id": "female_front_bangs:Chloe_hair_bangs_01",
        "group_id": "female_front_bangs",
        "gender": "female",
        "role": "front_bangs",
        "object": "Chloe_hair_bangs_01",
        "pool": true,
        "preset": false
      },
      {
        "component_id": "female_front_bangs:Chloe_hair_bangs_02",
        "group_id": "female_front_bangs",
        "gender": "female",
        "role": "front_bangs",
        "object": "Chloe_hair_bangs_02",
        "pool": true,
        "preset": false
      },
      {
        "component_id": "female_front_bangs:Chloe_hair_bangs_03",
        "group_id": "female_front_bangs",
        "gender": "female",
        "role": "front_bangs",
        "object": "Chloe_hair_bangs_03",
        "pool": true,
        "preset": false
      },
      {
        "component_id": "female_front_bangs:Chloe_hair_bangs_04",
        "group_id": "female_front_bangs",
        "gender": "female",
        "role": "front_bangs",
        "object": "Chloe_hair_bangs_04",
        "pool": true,
        "preset": false
      },
      {
        "component_id": "female_front_bangs:Chloe_hair_bangs_05",
        "group_id": "female_front_bangs",
        "gender": "female",
        "role": "front_bangs",
        "object": "Chloe_hair_bangs_05",
        "pool": true,
        "preset": false
      },
      {
        "component_id": "female_side:Chloe_hair_side_01",
        "group_id": "female_side",
        "gender": "female",
        "role": "side_coverage",
        "object": "Chloe_hair_side_01",
        "pool": true,
        "preset": false
      },
      {
        "component_id": "female_side:Chloe_hair_side_02",
        "group_id": "female_side",
        "gender": "female",
        "role": "side_coverage",
        "object": "Chloe_hair_side_02",
        "pool": true,
        "preset": false
      },
      {
        "component_id": "female_side:Chloe_hair_side_03",
        "group_id": "female_side",
        "gender": "female",
        "role": "side_coverage",
        "object": "Chloe_hair_side_03",
        "pool": true,
        "preset": false
      },
      {
        "component_id": "female_side:Chloe_hair_side_04",
        "group_id": "female_side",
        "gender": "female",
        "role": "side_coverage",
        "object": "Chloe_hair_side_04",
        "pool": true,
        "preset": false
      },
      {
        "component_id": "female_side:Chloe_hair_side_05",
        "group_id": "female_side",
        "gender": "female",
        "role": "side_coverage",
        "object": "Chloe_hair_side_05",
        "pool": true,
        "preset": false
      },
      {
        "component_id": "male_base_cap:Colin_hair_base_01",
        "group_id": "male_base_cap",
        "gender": "male",
        "role": "base_cap",
        "object": "Colin_hair_base_01",
        "pool": true,
        "preset": false
      },
      {
        "component_id": "male_base_cap:Colin_hair_base_02",
        "group_id": "male_base_cap",
        "gender": "male",
        "role": "base_cap",
        "object": "Colin_hair_base_02",
        "pool": true,
        "preset": false
      },
      {
        "component_id": "male_side:Colin_hair_side_01",
        "group_id": "male_side",
        "gender": "male",
        "role": "side_coverage",
        "object": "Colin_hair_side_01",
        "pool": true,
        "preset": false